id	title	text	author	date	url	source	section_name	source_name
wikipedia_60	Intelligence artificielle	« Risque inacceptable : les systèmes d'IA considérés comme une menace évidente pour la sécurité, les moyens de subsistance et les droits des personnes seront interdits. Il s'agit notamment des systèmes ou applications d'IA qui manipulent le comportement humain pour priver les utilisateurs de leur libre arbitre (par exemple, des jouets utilisant une assistance vocale incitant des mineurs à avoir un comportement dangereux) et des systèmes qui permettent la notation sociale par les États. »			https://fr.wikipedia.org/wiki/Intelligence_artificielle	wikipedia	Section 61	
wikipedia_61	Intelligence artificielle	"En décembre 2022, le « premier forum mondial sur l'éthique de l'IA », réunion ministérielle internationale, est réuni à Prague, sous l'égide de l'Unesco.
La même année, l’Unesco, estimant que « l'autorégulation de l'industrie n'est manifestement pas suffisante pour éviter ces préjudices éthiques », a publié un communiqué (adopté le 23 novembre 2021) demandant à tous les États de mettre en œuvre sa recommandation sur l'éthique de l'intelligence artificielle afin de construire un cadre législatif et éthique pour l'IA.
L’objectif est de n'utiliser l’IA que lorsque les atouts qu'elle peut offrir sont bien identifiés, et qu’on peut éviter, limiter et réparer les risques qui lui sont associés (en particulier lors d'usages non-pacifiques, malveillants et/ou aggravant les inégalités et des clivages). Ici, l'ONU, invite à ne pas utiliser l'IA quand elle met en péril la protection des données (tous les individus doivent pouvoir effacer et accéder aux enregistrements de leurs données personnelles, et les organismes de réglementation du monde entier doivent faire respecter ces dispositions). Cette recommandation vient aussi interdire la notation sociale et la surveillance de masse, contraires aux droits de l'homme et aux libertés fondamentales, et rejette l’idée d’accorder une personnalité juridique à l’IA « La Recommandation souligne que, lors de l'élaboration de cadres réglementaires, les États membres doivent tenir compte du fait que la responsabilité et l'obligation de rendre des comptes incombent toujours aux êtres humains en dernier ressort et que les technologies de l'IA ne devraient pas être dotées elles-mêmes d'une personnalité juridique ».
L’évaluation des IA prend en compte ses impacts éthiques sur les individus, sur la société et sur l'environnement. L’objectif étant à terme de créant une infrastructure juridique et technique ad hoc, ainsi qu’un responsable (indépendant) de l'éthique de l'IA pour surveiller l’utilisation et la création des IA qui devraient « privilégier les méthodes d'IA économes en données, en énergie et en ressources ». D’un point de vue écologique, les gouvernements sont invités, lors du cycle de vie du système d'IA à analyser son « empreinte carbone, sa consommation d'énergie et l'impact environnemental de l'extraction des matières premières pour soutenir la fabrication des technologies d'IA », tout en cherchant à diminuer l'impact environnemental du numérique en investissant dans les technologies vertes. Ainsi, « si les systèmes d'IA ont un impact négatif disproportionné sur l'environnement, la Recommandation préconise de ne pas les utiliser ».
En 2023, l’UNESCO réitère son appel à la mise en œuvre rapide de sa Recommandation sur l’éthique de l’intelligence artificielle, adoptée à l'unanimité par les 193 États-membres. « C’est le défi de notre temps », et il est « urgent que tous transposent ce cadre sous la forme de stratégies et de réglementations nationales. Nous devons traduire les engagements en actes » a commenté Audrey Azoulay (directrice générale de l'Unesco). L'ONU appelle ainsi les États qui ne l'ont pas déjà fait à rejoindre les plus de 40 pays « de toutes les régions du monde » qui ont commencé à créer de tels garde-fous, pour notamment créer un outil législatif capable d'encadrer et de surveiller les IA, tout en veillant à la protection des données personnelles et sensibles, et en sensibilisant la population mondiale à un usage responsable de l'IA.
En 2023, lors de la 57e Journée mondiale de la paix, le pape François exprime ses préoccupations quant aux conséquences potentielles de l'IA sur la paix mondiale et demande à la communauté internationale de définir un traité international contraignant pour réglementer son développement et son utilisation. Il se montre particulièrement préoccupé par « la possibilité de mener des opérations militaires à travers des systèmes de contrôle à distance », citant notamment les systèmes d’armes létales autonomes."			https://fr.wikipedia.org/wiki/Intelligence_artificielle	wikipedia	Section 62	
wikipedia_62	Intelligence artificielle	"Droits des robots
En 2017, le Parlement européen a demandé à une commission d'étudier la possibilité qu'un robot doté d'une intelligence artificielle puisse être considéré comme une personne juridique,. Advenant un dommage causé à un tiers par une intelligence artificielle, celle-ci pourrait être condamnée à réparer ce dommage. Il serait envisageable de conférer une personnalité électronique à tout robot prenant des décisions autonomes ou interagissant de manière indépendante avec des tiers, au même titre qu'une personne morale et physique."			https://fr.wikipedia.org/wiki/Intelligence_artificielle	wikipedia	Section 63	
wikipedia_63	Intelligence artificielle	"Gouvernance démocratique
En 2023, Mark Coeckelbergh et Henrik Skaug Saetra, respectivement philosophe renommé de l'éthique des technologies et expert en sciences politiques, se penchent sur la question de l'intelligence artificielle (IA) et son potentiel rôle dans la lutte contre le changement climatique. Ils plaident pour une intégration des IA dans les politiques démocratiques, soulignant qu’elles peuvent faciliter la délibération et la prise de décisions. Toutefois, ils avertissent également que l'IA pourrait devenir un outil si puissant qu'il pourrait entièrement remplacer le gouvernement, entraînant des problèmes sociaux majeurs.
Pour illustrer leur propos, Coeckelbergh et Saetra présentent deux cas extrêmes : une démocratie sans remplacement des humains (AI-augmented democracy) et une technocratie dirigée par l'IA (AI-driven technocracy). Ces deux cas extrêmes sont choisis pour démontrer les implications opposées de l'intégration de l'IA dans la gouvernance.
Dans une démocratie sans remplacement des humains, l’IA est présentée comme un simple outil visant à faciliter la prise de décision. Par exemple, elle peut être utilisée pour la traduction, la vérification des faits, ou la prise de notes. Ici, l'IA soutient le processus démocratique sans en prendre le contrôle.
En revanche, dans une démocratie avec remplacement, l’IA prend toutes les décisions, sans aucune intervention humaine. Cette approche, selon Saetra, pose cinq problèmes majeurs :"			https://fr.wikipedia.org/wiki/Intelligence_artificielle	wikipedia	Section 64	
wikipedia_64	Intelligence artificielle	"les citoyens ont besoin d'une pleine participation politique pour être satisfaits ;
les citoyens ne considèrent pas comme légitime un gouvernement auquel ils ne participent pas ;
les ordinateurs ne devraient pas prendre de décisions affectant la vie et le bien-être des personnes ;
l'IA n'est pas transparente et ne peut donc pas être entièrement contrôlée par l'homme ;
l'obligation de rendre compte des conséquences des décisions politiques doit être claire, ce qui devient de moins en moins le cas lorsque l'IA prend des décisions.
Ces points soulignent les conséquences sociales et éthiques de la prise de décision par l’IA en ce qui concerne les humains. Ainsi, Coeckelbergh et Saetra concluent qu'une démocratie sans remplacement des humains est plus adaptée, l’IA y étant présente uniquement comme soutien et non comme entité décisionnelle.
Les deux auteurs estiment cependant qu’aucune des deux propositions n’est actuellement réalisable : les relations entre les humains et la technologie ne sont pas suffisamment évoluées pour permettre une utilisation éthique de l’IA. Ainsi, les décisions ne peuvent pas être prises uniquement par l’IA, car les erreurs sont encore trop fréquentes et les normes sociales et éthiques peu respectées."			https://fr.wikipedia.org/wiki/Intelligence_artificielle	wikipedia	Section 65	
wikipedia_65	Intelligence artificielle	"Demandes de moratoire
Début 2023, l'apparition de ChatGPT suscite une grande curiosité, de l'enthousiasme, mais aussi des craintes sérieuses : « Devons-nous laisser les machines inonder nos canaux d'information de propagande et de mensonges? (…) Devons-nous risquer de perdre le contrôle de notre civilisation? Ces décisions ne doivent pas être déléguées à des leaders technologiques non élus » affirment Elon Musk, Steve Wozniak (cofondateur d'Apple) et des centaines d'experts. Le 29 mars 2023, ceux-ci, invoquant des « risques majeurs pour l'humanité », signent une pétition qui appelle le monde à un moratoire d'au moins six mois sur ces recherches, jusqu'à la mise en place de systèmes de sécurité, incluant : la création d'autorités réglementaires dédiées, des moyens pour efficacement surveiller des IA et des systèmes les utilisant, la mise à disposition de techniques permettant de mieux différencier le réel de l'artificiel, et la création d'institutions pouvant limiter les « perturbations économiques et politiques dramatiques (en particulier pour la démocratie) que l'IA provoquera »."			https://fr.wikipedia.org/wiki/Intelligence_artificielle	wikipedia	Section 66	
wikipedia_66	Intelligence artificielle	"Philosophie
Courants de pensée
La cybernétique naissante des années 1940 revendiquait très clairement son caractère pluridisciplinaire et se nourrissait des contributions les plus diverses : neurophysiologie, psychologie, logique, sciences sociales, etc. Elle envisagea deux approches des systèmes, approches reprises par les sciences cognitives et de ce fait l'intelligence artificielle[réf. souhaitée] : une approche par la décomposition (du haut vers le bas, comme avec les systèmes experts) et une approche contraire par construction progressive du bas vers le haut, comme avec l'apprentissage automatique.
Ces deux approches se révèlent plutôt complémentaires que contradictoires : on est à l'aise pour décomposer rapidement ce que l'on connaît bien, et une approche pragmatique à partir des seuls éléments que l'on connaît afin de se familiariser avec les concepts émergents est plus utile pour les domaines inconnus. Elles sont respectivement à la base des hypothèses de travail que constituent le cognitivisme et le connexionnisme, qui tentent aujourd'hui (2005)[Passage à actualiser] d'opérer progressivement leur fusion.
Le guide pratique de Linux sur l'intelligence artificielle v3.0, révisé le 15 décembre 2012, adopte pour la commodité du lecteur la taxinomie suivante :"			https://fr.wikipedia.org/wiki/Intelligence_artificielle	wikipedia	Section 67	
wikipedia_67	Intelligence artificielle	"systèmes symboliques ;
connexionnisme ;
calcul évolutif (algorithmes génétiques, par exemple) ;
alife (vie artificielle) et complexité ;
agents et robotique."			https://fr.wikipedia.org/wiki/Intelligence_artificielle	wikipedia	Section 68	
wikipedia_68	Intelligence artificielle	"Cognitivisme
Le cognitivisme considère que le vivant, tel un ordinateur (bien que par des procédés très différents), manipule essentiellement des symboles élémentaires. Dans son livre La société de l'esprit, Marvin Minsky, s'appuyant sur des observations du psychologue Jean Piaget, envisage le processus cognitif comme une compétition d'agents fournissant des réponses partielles et dont les avis sont arbitrés par d'autres agents. Il cite les exemples suivants de Piaget :"			https://fr.wikipedia.org/wiki/Intelligence_artificielle	wikipedia	Section 69	
wikipedia_69	Intelligence artificielle	"l'enfant croit d'abord que plus le niveau d'eau est élevé dans un verre, plus il y a d'eau dans ce verre. Après avoir joué avec des transvasements successifs, il intègre le fait que la notion de hauteur du liquide dans le verre entre en compétition avec celle du diamètre du verre, et arbitre de son mieux entre les deux ;
il vit ensuite une expérience analogue en manipulant de la pâte à modeler : la réduction de plusieurs objets temporairement représentés à une même boule de pâte l'incite à dégager un concept de conservation de la quantité de matière.
Au bout du compte, ces jeux d'enfants se révèlent essentiels à la formation de l'esprit, qui dégagent quelques règles pour arbitrer les différents éléments d'appréciation qu'il rencontre, par essais et erreurs."			https://fr.wikipedia.org/wiki/Intelligence_artificielle	wikipedia	Section 70	
wikipedia_70	Intelligence artificielle	"Connexionnisme
Le connexionnisme, se référant aux processus auto-organisationnels, envisage la cognition comme le résultat d'une interaction globale des parties élémentaires d'un système. On ne peut nier que le chien dispose d'une sorte de connaissance des équations différentielles du mouvement, puisqu'il arrive à attraper un bâton au vol, ni qu'un chat ait aussi une sorte de connaissance de la loi de chute des corps, puisqu'il se comporte comme s'il savait à partir de quelle hauteur il ne doit plus essayer de sauter directement pour se diriger vers le sol. Cette faculté, qui évoque l'intuition des philosophes, se caractériserait par la prise en compte et la consolidation d'éléments perceptifs dont aucun pris isolément n'atteint le seuil de la conscience, ou en tout cas n'y déclenche d'interprétation particulière."			https://fr.wikipedia.org/wiki/Intelligence_artificielle	wikipedia	Section 71	
wikipedia_71	Intelligence artificielle	"Synthèse
Trois concepts reviennent de façon récurrente dans la plupart des travaux :"			https://fr.wikipedia.org/wiki/Intelligence_artificielle	wikipedia	Section 72	
wikipedia_72	Intelligence artificielle	"la redondance (le système est peu sensible à des pannes ponctuelles) ;
la réentrance (les composants s'informent en permanence entre eux ; cette notion diffère de la réentrance en programmation) ;
la sélection (au fil du temps, les comportements efficaces sont dégagés et renforcés)."			https://fr.wikipedia.org/wiki/Intelligence_artificielle	wikipedia	Section 73	
wikipedia_73	Intelligence artificielle	"Intelligence artificielle forte
Le concept d'intelligence artificielle forte fait référence à une machine capable non seulement de produire un comportement intelligent, notamment de modéliser des idées abstraites, mais aussi d'éprouver une impression d'une réelle conscience, de « vrais sentiments » (notion dont la définition n'est pas universelle), et « une compréhension de ses propres raisonnements ».
Contrairement à l'intelligence artificielle générale, l'intelligence artificielle forte fait donc le plus souvent intervenir des notions philosophiques de conscience qui font que les capacités de l'intelligence artificielle ne suffisent pas à dire si elle est « forte ». Cela dit, aucune définition de la conscience pour une IA ne fait consensus. Les termes « intelligence artificielle forte » et « intelligence artificielle générale » sont parfois en pratique utilisés de manière interchangeable.
En partant du principe, étayé par les neurosciences, que la conscience a un support biologique et donc matériel, les scientifiques ne voient généralement pas d'obstacle théorique à la création d'une intelligence consciente sur un support matériel autre que biologique. Selon les tenants de l'IA forte, si à l'heure actuelle il n'y a pas d'ordinateurs ou d'algorithmes aussi intelligents que l'être humain, ce n'est pas un problème d'outil mais de conception. Il n'y aurait aucune limite fonctionnelle (un ordinateur est une machine de Turing universelle avec pour seules limites celles de la calculabilité), seulement des limites liées à l'aptitude humaine à concevoir les logiciels appropriés (programme, base de données…)."			https://fr.wikipedia.org/wiki/Intelligence_artificielle	wikipedia	Section 74	
wikipedia_74	Intelligence artificielle	"Diversité des opinions
Les principales opinions soutenues pour répondre à la question d'une intelligence artificielle forte (c'est-à-dire douée d'une sorte de conscience) sont les suivantes :"			https://fr.wikipedia.org/wiki/Intelligence_artificielle	wikipedia	Section 75	
wikipedia_75	Intelligence artificielle	"impossible : la conscience serait le propre des organismes vivants (supérieurs), et elle serait liée à la nature des systèmes biologiques. Cette position est défendue par certains philosophes et sociologues comme Harry Collins, pour qui l'intelligence requiert une immersion dans la société humaine, et donc un corps humain, et peut rappeler le courant du vitalisme ;
impossible avec des machines manipulant des symboles comme les ordinateurs actuels, mais possible avec des systèmes dont l'organisation matérielle serait fondée sur des processus quantiques. Des algorithmes quantiques sont théoriquement capables de mener à bien des calculs hors de l'atteinte pratique des calculateurs conventionnels (complexité en 
  
    
      
        
          N
          
            3
          
        
      
    
    {\displaystyle N^{3}}
  
 au lieu de 
  
    
      
        
          2
          
            N
          
        
      
    
    {\displaystyle 2^{N}}
  
, par exemple, sous réserve d'existence du calculateur approprié). Au-delà de la rapidité, le scientifique Roger Penrose défend dans la théorie de la réduction objective orchestrée l'idée controversée que la conscience nécessiterait un fonctionnement non compatible avec les lois de la physique classique, et accessible uniquement à des systèmes quantiques, ;
impossible car la pensée n'est pas un phénomène calculable par des processus discrets et finis. Cette théorie est notamment avancée par le philosophe John Searle et son expérience de la chambre chinoise. Une conscience est donc nécessaire pour accéder à l'intelligence, mais un système informatique ne serait capable que d'en simuler une, sans pour autant la posséder, renvoyant au concept philosophique du zombie ;
possible avec des ordinateurs manipulant des symboles. La notion de symbole est toutefois à prendre au sens large. Cette option inclut les travaux sur le raisonnement ou l'apprentissage symbolique basé sur la logique des prédicats, mais aussi les techniques connexionnistes telles que les réseaux de neurones, qui, à la base, sont définies par des symboles. Cette position est portée par des mouvements comme ceux du computationnalisme et est portée par des philosophes comme Hubert Dreyfus, pour qui le cerveau suit les lois de la physique et de la biologie, impliquant que l'esprit est donc un processus simulable. Cette dernière opinion constitue la position la plus engagée en faveur de l'intelligence artificielle forte.
Des auteurs comme Douglas Hofstadter (mais déjà avant lui Arthur C. Clarke ou Alan Turing ; voir le test de Turing) expriment par ailleurs un doute sur la possibilité de faire la différence entre une intelligence artificielle qui éprouverait réellement une conscience, et une autre qui simulerait exactement ce comportement (voir Zombie (philosophie)). Après tout, nous ne pouvons même pas être certains que d'autres consciences que la nôtre, y compris chez des humains, éprouvent réellement quoi que ce soit, si ce n'est par une pétition de principe qui spécule que chaque humain se retrouve à l'identique chez tous les autres. On retrouve là le problème connu du solipsisme en philosophie.
Même si une intelligence artificielle forte n'était guère possible, une IA peut être de plus en plus perçue comme forte par une majorité d'individus parallèlement à l'arrivée des IA génératives, dont les LLM (de l'anglais large language model) comme ChatGPT ou Google Bard, et les outils de génération d'images comme Midjourney, DALL-E ou Stable Diffusion. En effet, le champ d'applications de ces outils est beaucoup plus large qu'auparavant : création, synthèse, traduction de textes, composition d'images, de vidéos à partir de prompts, textes descriptifs. Il devient ainsi de plus en plus difficile pour un être humain de distinguer des créations humaines de celles provenant d'une IA générative.
Emily Bender estime que les grands modèles de langage comme ChatGPT ne font que régurgiter plus ou moins aléatoirement des morceaux de texte venant des corpus ayant servi à leur entraînement, sans en comprendre le sens. Elle les appelle ainsi des « perroquets stochastiques ». De même, Jean-Gabriel Ganascia considère que le contenu qu'ils produisent n'est pas original et que leur utilisation dans la rédaction d'articles de recherche constitue une forme de plagiat. Ilya Sutskever considère au contraire que ces modèles, à force d'être entraînés à prédire le mot suivant, acquièrent une forme de « modèle du monde » et une représentation « compressée, abstraite et utilisable » des concepts."			https://fr.wikipedia.org/wiki/Intelligence_artificielle	wikipedia	Section 76	
wikipedia_76	Intelligence artificielle	"Intelligence artificielle faible
La notion d'intelligence artificielle faible constitue une approche pragmatique d'ingénieur : chercher à construire des systèmes de plus en plus autonomes (pour réduire le coût de leur supervision), des algorithmes capables de résoudre des problèmes d'une certaine classe, etc. Mais, cette fois, la machine simule l'intelligence, elle semble agir comme si elle était intelligente.
Les tenants de l'IA forte admettent que s'il y a bien dans ce cas simple simulation de comportements intelligents, il est aisé de le découvrir et qu'on ne peut donc généraliser. En effet, si on ne peut différencier expérimentalement deux comportements intelligents, celui d'une machine et celui d'un humain, comment peut-on prétendre que les deux choses ont des propriétés différentes ? Le terme même de « simulation de l'intelligence » est contesté et devrait, toujours selon eux, être remplacé par « reproduction de l'intelligence ».
Si le terme intelligence artificielle peut désigner un système capable de résoudre plusieurs problèmes de façon relativement autonome tout en ne faisant que simuler le principe d'intelligence, il peut aussi désigner des systèmes capables de résoudre uniquement un type de problème pour un jeu de données prédéfini. On peut donner pour exemple un système entrainé à reconnaitre des chiffres écrits à la main, comme ceux utilisés par La Poste, qui malgré sa grande performance sur sa tâche, serait incapable de fonctionner sur un problème sortant de ce pour quoi il a été conçu. Ces intelligences artificielles, aussi nommées « intelligences artificielles étroites » (terme issu de l'anglais narrow AI), sont conçus pour effectuer une tâche précise, contrairement à une intelligence artificielle générale."			https://fr.wikipedia.org/wiki/Intelligence_artificielle	wikipedia	Section 77	
wikipedia_77	Intelligence artificielle	"Question de l'intelligence
La définition du terme « intelligence artificielle » pose une question fondamentale : Qu'est-ce que l'intelligence ?
L'intelligence peut se définir de manière générale comme un ensemble de capacités cognitives permettant de résoudre des problèmes ou de s'adapter à un environnement.
Le chercheur en IA Yann Le Cun avance que le noyau de l'intelligence est la faculté de prédire. Les bases de la programmation des premiers systèmes experts supposent de « maîtriser parfaitement un problème et d'avoir une vue précise de toutes les solutions », afin d'en programmer précisément le comportement. Mais les systèmes d'IA modernes à base d'apprentissage automatique sont entraînés à prédire la réponse attendue, ou à générer une solution correcte. Leurs capacités émergent ainsi progressivement, par essai-erreur, sans que le programmeur n'ait besoin de fournir une solution algorithmique, ou même de savoir comment résoudre le problème. Dans tous les cas, l'efficacité de l'intelligence artificielle dépend de sa capacité à répondre aux objectifs donnés par les programmeurs et à tendre vers l'autonomie décisionnelle, ce qui présuppose, entre autres, une capacité de prédiction.
Le philosophe John Searle considère quant à lui que la faculté de comprendre est plus importante dans la définition de l'intelligence. Il essaie de démontrer la faiblesse des systèmes d'intelligence artificielle et les limites du test de Turing, par son expérience de la chambre chinoise, concluant : « on ne devrait pas dire d'une IA qu'elle comprend les informations qu'elle traite lorsqu'elle manipule des règles de syntaxe sans maîtriser la sémantique, c'est-à-dire sans reconnaître le sens des mots. La question de savoir si on peut parler d'une véritable intelligence reste donc ouverte ». L'apprentissage automatique fonctionne cependant différemment de l'IA symbolique, qui était populaire à l'époque où Searle a conçu l'expérience de pensée de la chambre chinoise en 1980."			https://fr.wikipedia.org/wiki/Intelligence_artificielle	wikipedia	Section 78	
