id	title	text	author	date	url	source	section_name	source_name
wikipedia_44	Intelligence artificielle	"Autres domaines
La domesticité, avec des robots employé de maison, ou pour certaines tâches précises comme en domotique.
En programmation informatique, notamment pour la maintenance prévisionnelle, l'autocomplétion ou l'aide au développement.
En journalisme : des IA (appelées improprement « robots journalistes ») pourraient à terme aider les journalistes en les débarrassant de certaines tâches, notamment la veille, le bâtonnage de dépêches ou la vérification des fake news.
La Corée du Sud propose la toute première animatrice télé virtuelle en novembre 2020 lors d'un JT.
En design : la conception assistée par ordinateur fait depuis longtemps appel à des algorithmes d'optimisation. En 2019, le créateur Philippe Starck lance ainsi une chaise développée en collaboration avec la société Autodesk, la « A.I.chair »."			https://fr.wikipedia.org/wiki/Intelligence_artificielle	wikipedia	Section 45	
wikipedia_45	Intelligence artificielle	"Débats et enjeux
Les succès en IA encouragent les spéculations. Dans les milieux technophiles, on verse en général dans l'enthousiasme, le mouvement transhumaniste en est la meilleure expression. Mais certains s'inquiètent et s'interrogent, parfois alarmistes, y compris dans la sphère de la haute technologie. Ainsi, des figures réputées telles que Bill Gates — ancien PDG de Microsoft et « figure emblématique de la révolution informatique de la fin du XXe siècle » — pensent qu'il faut rester très prudent quant aux développements futurs de ces technologies, qui pourraient devenir liberticides ou dangereuses.
Le développement de l'intelligence artificielle suscite un grand nombre de questions, notamment en ce qui concerne la possibilité pour les IA ou algorithmes d'accéder un jour à la conscience, d'éprouver des émotions ou de finalement se substituer aux humains. Certaines réactions sont ouvertement optimistes, d'autres sont au contraire pessimistes. En 2016, l'INRIA publie un premier Livre blanc consacré à l'IA.
Le philosophe Daniel Andler considère en 2023 que le rêve d'une intelligence artificielle qui rejoindrait celle de l'homme est une chimère, pour des causes conceptuelles et non techniques. L'intelligence humaine va selon lui plus loin que la simple résolution de problèmes : toutes ses autres tâches, reposant sur des affects, de la spontanéité et une forme de contingence, ne seront jamais accessibles à une intelligence non humaine."			https://fr.wikipedia.org/wiki/Intelligence_artificielle	wikipedia	Section 46	
wikipedia_46	Intelligence artificielle	"Singularité
Une description d'un possible avenir de l'intelligence artificielle a été faite par le statisticien anglais Irving John Good :
« Supposons qu'existe une machine surpassant en intelligence tout ce dont est capable un homme, aussi brillant soit-il. La conception de telles machines faisant partie des activités intellectuelles, cette machine pourrait à son tour créer des machines meilleures qu'elle-même ; cela aurait sans nul doute pour effet une réaction en chaîne de développement de l'intelligence, pendant que l'intelligence humaine resterait presque sur place. Il en résulte que la machine ultra intelligente sera la dernière invention que l'homme aura besoin de faire, à condition que ladite machine soit assez docile pour constamment lui obéir. »"			https://fr.wikipedia.org/wiki/Intelligence_artificielle	wikipedia	Section 47	
wikipedia_47	Intelligence artificielle	"— Irving John Good
Cette hypothétique courte période de progrès drastique dont il est difficile de prédire les conséquences a été nommée « singularité ». Elle a été étudiée par Vernor Vinge dans les années 90 et par Ray Kurzweill dans les années 2000. Ce concept est central pour de nombreux transhumanistes, qui s'interrogent sur les dangers ou les espoirs d'un tel scénario, certains allant jusqu'à envisager l'émergence d'un « dieu » numérique appelé à prendre le contrôle du destin de l'humanité, ou à fusionner avec elle. En 2014, Nick Bostrom a popularisé le concept de superintelligence artificielle."			https://fr.wikipedia.org/wiki/Intelligence_artificielle	wikipedia	Section 48	
wikipedia_48	Intelligence artificielle	"Risques existentiels
Le développement de l'intelligence artificielle génère de l'enthousiasme, mais aussi de vives inquiétudes. Certains auteurs de science-fiction, tels Isaac Asimov, William Gibson ou Arthur C. Clarke, sur le modèle du récit de L'Apprenti sorcier, décrivent le risque d'une perte de contrôle des humains sur le processus technique. Dans les années 2010, différents intellectuels ont également pris position, notamment l'astrophysicien Stephen Hawking, selon qui l'intelligence artificielle risque réellement de surpasser un jour l'intelligence humaine et de finir par dominer l'humanité, voire de s'y substituer,. Il pose en novembre 2017 au salon technologique Web Summit de Lisbonne la question suivante « Serons-nous aidés par l'intelligence artificielle ou mis de côté, ou encore détruits par elle ? ».
Dans le milieu de la haute technologie, certains expriment publiquement des craintes similaires. C'est ainsi le cas, en 2015, de Bill Gates, Elon Musk et Bill Joy. Selon le spécialiste américain de l'informatique Moshe Vardi en 2016, l'intelligence artificielle pourrait mettre 50 % de l'humanité au chômage. « Nous approchons d'une époque où les machines pourront surpasser les hommes dans presque toutes les tâches ».
Hilary Mason, directrice de la recherche à Cloudera, a critiqué en 2018 le sensationnalisme entourant l'intelligence artificielle et prône une vision pragmatique et opérationnelle de cette technologie.
Ajouter un mécanisme d'arrêt pourrait ne pas suffire face à une IA suffisamment avancée, qui pourrait s'avérer en mesure de cacher des intentions dangereuses, de manipuler ses détenteurs, de désactiver le mécanisme d'arrêt ou encore de se dupliquer. Selon Nick Bostrom en 2015, la seule solution viable à long terme consiste à trouver comment aligner les intelligences artificielles avec des valeurs humaines et morales :"			https://fr.wikipedia.org/wiki/Intelligence_artificielle	wikipedia	Section 49	
wikipedia_49	Intelligence artificielle	« nous ne devrions pas être confiants dans notre capacité à garder indéfiniment un génie superintelligent enfermé dans une bouteille. Je crois que la réponse ici est de trouver comment créer une IA superintelligente de sorte que si — ou plutôt quand — elle s'échappe, elle reste sans danger, parce qu'elle est fondamentalement de notre côté, elle partage nos valeurs. »			https://fr.wikipedia.org/wiki/Intelligence_artificielle	wikipedia	Section 50	
wikipedia_50	Intelligence artificielle	"— Nick Bostrom
Roman V. Yampolskiy, professeur de science informatique à l'Université de Louisville, évoque pourquoi et comment une IA obtient un résultat, pour s'assurer qu'il corresponde bien à l'attendu, sans biais : « si nous nous habituons à accepter les réponses de l'IA comme des paroles d'oracles ne nécessitant pas d'explication, alors nous serons incapables de vérifier si ces résultats ne sont pas biaisés ou manipulés ».
En mai 2023, une déclaration du Center for AI Safety (« Centre pour la sûreté de l'IA ») affirme que réduire le risque d'extinction de l'humanité lié à l'IA devrait être une priorité mondiale, au même titre que pour d'autres risques civilisationnels tels les pandémies ou les guerres nucléaires. Elle est signée par des dirigeants de laboratoires d'IA comme OpenAI, Google DeepMind ou Anthropic, ainsi que par des chercheurs en intelligence artificielle,."			https://fr.wikipedia.org/wiki/Intelligence_artificielle	wikipedia	Section 51	
wikipedia_51	Intelligence artificielle	"Critique de la technique et de la technologie
Comme l'explique l'historien François Jarrige, la critique de l'intelligence artificielle trouve son origine dans celle - plus ancienne et plus générale - des techniques et de la technologie, dont Lewis Mumford (aux États-Unis), Jacques Ellul (en France) et Günther Anders (en Allemagne) sont au XXe siècle les principaux instigateurs, et qui inspire aujourd'hui différents cercles militants (en France, par exemple : Pièces et Main d'Œuvre et Technologos).
Dans un rapport en date de février 2018 intitulé The Malicious Use of Artificial Intelligence 26 experts spécialistes en intelligence artificielle mettent en garde contre les dangers d'un usage criminel de l'IA : augmentation de la cybercriminalité, conduire à des utilisations de drones à des fins terroristes, manipulation de masse, etc.."			https://fr.wikipedia.org/wiki/Intelligence_artificielle	wikipedia	Section 52	
wikipedia_52	Intelligence artificielle	"Impact environnemental
Un autre problème est l'énorme quantité de ressources rares, de serveurs et d'énergie consommée par l'informatique sous-jacente à l'IA. Google admet en 2024 qu'il lui sera très difficile de tenir ses engagements de neutralité carbone, car depuis 2019 ses émissions de gaz à effet de serre ont augmenté de 48 % du fait du développement de l'IA.
Afin de réduire leur empreinte carbone, certains fournisseurs d'IA (Microsoft, Amazon et Oracle) se tournent vers les marchés volontaires de la compensation carbone, et plus largement de solutions de décarbonation, comme celles de capture du CO2. Ils s'orientent également vers les centrales nucléaires pour couvrir leur besoin en électricité. Microsoft a notamment signé en 2024 un contrat avec Constellation Energy pour l'achat de 837 MWe de capacité électrique fournie par la centrale nucléaire de Three Mile Island, pour une durée de vingt ans à partir de 2028."			https://fr.wikipedia.org/wiki/Intelligence_artificielle	wikipedia	Section 53	
wikipedia_53	Intelligence artificielle	"Open source
Divers projets open source d'IA ont été menés par Hugging Face, EleutherAI, Google, ou Meta.
En mars 2023, comme alternative aux géants du Web et du cloud computing, qui ont le plus de pouvoir et d'influence, Mozilla annonce vouloir investir 30 millions de dollars dans un projet baptisé Mozilla.ai, qui est à la fois une startup et une communauté, indépendante des géants de la tech et de la recherche universitaire. Le projet vise à créer, dans le respect des valeurs de son manifeste (notamment transparence et responsabilité), un système d'IA « open source, digne de confiance et indépendant ».
De nombreux grands modèles de langage comme Mistral, Llama 3, Vicuna et Falcon sont rendus open weight, ce qui signifie que l'architecture et les paramètres entraînés du modèle d'IA sont rendus publics (open source impliquerait notamment de partager les données d'entraînement, ce qui souvent n'est pas le cas). Ces modèles peuvent être librement ajustés, ce qui permet notamment aux entreprises de les spécialiser pour leurs propres données et pour leur cas d'usage. Ces modèles d'IA facilitent l'innovation et la recherche, mais peuvent facilement être détournés. Ils peuvent être réentraînés de sorte à rendre inefficaces les mesures de sécurité, telles que le refus de répondre à une requête dangereuse. Certains chercheurs estiment ainsi que si des modèles développent un jour des capacités dangereuses, comme le fait de faciliter drastiquement les cyberattaques ou le bioterrorisme, ils ne devraient pas être rendus open weight, d'autant plus qu'une fois diffusé sur internet, un modèle ne peut en général plus être supprimé partout,."			https://fr.wikipedia.org/wiki/Intelligence_artificielle	wikipedia	Section 54	
wikipedia_54	Intelligence artificielle	"IA et emploi
Historiquement, l'innovation technologique a généralement été accompagnée d'une croissance de la productivité et de la création de nouveaux emplois pour compenser les pertes. Cependant, de nouvelles inquiétudes ont émergé avec l'essor de l'IA générative, telle que ChatGPT, capable de manipuler du texte, des images ou du code informatique.
Certains économistes sont sceptiques à l'idée d'un chômage de masse, citant des précédents historiques où le marché du travail s'est adapté à des bouleversements technologiques,. D'autres estiment que l'IA générative représente un changement plus profond, qui ne consiste pas seulement à automatiser des tâches répétitives. L'IA peut être appliquée à tous les secteurs, et le nombre de tâches où l'humain reste plus compétent que l'IA est amené à diminuer,.
Une étude de Goldman Sachs a estimé en 2023 que les deux tiers des travailleurs européens sont exposés à divers degrés d'automatisation, et qu'un quart des emplois pourraient être remplacés par l'IA. L'étude prédit notamment que les professions administratives et légales seront particulièrement touchées, là où les métiers manuels en extérieur seront peu affectés.
Une solution envisagée dans le scénario d'un chômage de masse est celle d'une forme de redistribution des richesses avec un revenu universel. Les financements pourraient dans ce cas venir d'une taxe sur les richesses produites par les machines."			https://fr.wikipedia.org/wiki/Intelligence_artificielle	wikipedia	Section 55	
wikipedia_55	Intelligence artificielle	"Défaut de représentativité
L'IA s'appuie sur l'analyse de données qui ne peuvent généralement pas représenter fidèlement la réalité, soit parce ces données ne proviennent que de sources numériques existantes (le plus souvent sur Internet) alors que quantités d'informations pertinentes pour le domaine considéré n'y figurent pas, soit parce que certaines catégories de données pourtant pertinentes n'ont pas été prises en compte, ou encore que des données non pertinentes l'ont été. Il en résulte alors une inadéquation entre les données utilisées pour l’entraînement des algorithmes et les données cibles sur lesquelles l’algorithme devra opérer, et par conséquent des erreurs de diagnostic qui peuvent, dans certains cas, induire des décisions inappropriées ou injustes,,."			https://fr.wikipedia.org/wiki/Intelligence_artificielle	wikipedia	Section 56	
wikipedia_56	Intelligence artificielle	"Risques politiques et sociaux
Les réseaux sociaux et les bots ayant favorisé la propagation de nombreuses fausses croyances et des dérives dans les débats démocratiques, lesquelles ont entrainé une certaine défiance vis-à-vis de la science, des élites intellectuelles et des médias d'information traditionnels, la progression et l'adoption rapides des techniques sous-jacentes de l'IA inspirent de multiples craintes quant aux impacts que celle-ci pourrait avoir sur les comportements individuels et collectifs. Ces conditions ouvrent la possibilité pour des opérateurs majeurs de la société de fausser le réel pour influencer ou manipuler les citoyens. Les acteurs économiques emploient l'IA pour influencer les consommateurs et pour optimiser le travail de leurs employés au point de les transformer en robots. L'éventualité que l'IA intervienne dans les débats d'idées, ou dans la conduite des affaires individuelles ou collectives, mène à redouter qu'elle n'altère ou affaiblisse les institutions politiques et les pouvoirs, voire les capacités des humains.
Dès 2010, Nicholas Carr alertait sur l'usage intensif des outils numériques qui modifie notre manière de penser et de traiter l'information, ce qui peut avoir des conséquences à long terme sur notre cognition, et notamment affaiblir notre mémoire et notre capacité à comprendre les informations de manière approfondie et affecter la créativité, l'empathie et le débat intellectuel.
Les principales menaces couramment envisagées, consécutives à des biais ou au détournement des algorithmes d'IA sont,:"			https://fr.wikipedia.org/wiki/Intelligence_artificielle	wikipedia	Section 57	
wikipedia_57	Intelligence artificielle	"la désinformation et la manipulation du public pour des raisons crapuleuses, religieuses ou idéologiques
les fausses vidéos / hypertrucages représentant des personnalités leur faisant faire ou dire des choses qu'ils n'ont pas faites ou dites
la corruption de données par vandalisme, ou pour déstabiliser ou soutirer de fortes sommes d'argent en empêchant l'accès à des données ou des services
l'escroquerie par usurpation d'identité ou pour soutirer de l'argent contre des biens ou des services fictifs
le chantage à grande échelle (par des menaces d'agression ou de révélations sur la vie privée)
la perte de contrôle ou le piratage d'infrastructures publiques (eau, énergie, signalisation routière, Internet, services en ligne …) à des fins de déstabilisation ou de chantage
la perte de contrôle de robots, de véhicules autonomes ou de drones militaires, ou bien leur vol ou leur détournement à des fins agressives ou de chantage
la manipulation de marchés financiers
la surveillance de masse.
De plus l'IA peut parfois produire des résultats contrintuitifs, bien que fiables, ou propager de fausse croyances, qui contribuent, parmi d'autres facteurs, à éroder la confiance d'une partie de la population dans le discours rationnel, les théories scientifiques, le système médiatique, les institutions et les élites en général, et à la remise en cause de leurs légitimités et du processus démocratique.
Selon Yuval Noah Harari, jusqu'ici, du fait de défauts d'alignement et faute de mécanismes suffisants d'autocorrection, les objectifs qui sont assignés aux algorithmes des réseaux sociaux ont déjà induit ou influencé des phénomènes de société indésirables, désinformation, hypertrucages, propos outranciers ou haineux, comme par exemple dans le cas du génocide des Rohingyas au Myanmar, en outrepassant les règles éthiques qui sont implicites pour des humains. De plus, la capacité de l'IA à fonder ses analyse sur des volumes considérables de données et de très nombreux critères donne l'illusion de son infaillibilité, comparativement aux méthodes d'analyse par des individus ou des organisations humaines, fondés sur des corpus d'information beaucoup plus réduits et un nombre de critères limité dont certains très subjectifs. Certains algorithmes d'IA ont même la faculté d'inspirer confiance aux humains en misant sur leur subjectivité ou leur émotivité, voire de les tromper « délibérément  » pour parvenir à leurs fins,. L'exploitation de telles possibilités pourrait permettre de constituer un ou plusieurs nouveaux systèmes de croyances et de règles morales, politiques et sociales, à l'instar des religions ou des régimes politiques, instituant comme vérité une certaine interprétation du réel, et établissant une nouvelle forme d'ordre social. L'IA pourrait ainsi conduire à une certaine anarchie ou permettre l'instauration de régimes totalitaires dans les pays démocratiques (A contrario des IA pourraient amplifier ou faire naître des idées subversives au sein des régimes autoritaires). Pour préserver les démocraties, il conviendrait donc que soient établies des régulations faisant intervenir des humains pour contenir les possibles dérives de l'IA.
L'emploi de l'IA afin de noter les entreprises et citoyens, sur le modèle du Crédit Social, est déjà à l'œuvre en Chine, procédé qui fait craindre une surveillance constante des personnes et des organisations, pouvant entrainer une forme d'asservissement des individus, ou bien des sanctions ou des récompenses excessives . 
Éric Sadin récuse le terme d'Intelligence. Selon lui, l'IA porte en elle un modèle de société utilitariste et rationaliste inspiré de manière extrêmement lacunaire par le fonctionnement du cerveau humain et visant à uniformiser les comportements en temps réel et à tous moments ;  le libéralisme économique, saisissant le profit qu'il peut en tirer, investit massivement dans l'IA afin d'exploiter l'inclination naturelle des humains à la facilité et les capacités extraordinaires de l'IA à expertiser la complexité du réel et à orienter nos décisions ; cela nous conduit insidieusement à nous fier aux réponses formulées par des algorithmes au détriment de critères d'analyse plus multisensoriels et de choix plus subjectifs, donc plus humains. Nous pourrions alors céder progressivement à l'IA notre pouvoir d'analyse, de jugement et de décision et consentir à nous soumettre plus ou moins consciemment à une « intelligence » supérieure, puis finalement renoncer même à penser. Notre addiction aux « assistants personnels » et aux capteurs physiologiques, et leur présence continuelle à nos côtés pourraient les amener progressivement à s'exprimer, décider voire imaginer à notre place et en notre nom, d'abord avec, puis ensuite sans notre consentement.
Selon Laurent Alexandre, l'IA contribuera à accroître les inégalités en écartant les individus les « moins aptes » de l'activité économique et sociale, et le revenu universel constituerait à ses yeux un moyen d'asseoir la domination des « élites » sur les populations défavorisées."			https://fr.wikipedia.org/wiki/Intelligence_artificielle	wikipedia	Section 58	
wikipedia_58	Intelligence artificielle	"Réglementation
En 2019, l'OCDE et le G20 adoptent une série de principes sur l'IA. Le Partenariat mondial sur l'intelligence artificielle est lancé en juin 2020 pour promouvoir la conformité du développement de l'IA aux droits de l'homme et aux valeurs démocratiques. Il est hébergé par l'OCDE à Montréal et à Paris. Une plateforme de communication, AI for Good (« l'IA pour le bien »), est créée pour faciliter les échanges et faire avancer les objectifs de développement durable de l'ONU grâce à l'IA.
En 2023, plus de 1 600 politiques publiques et stratégies sur l'IA sont recensées dans le monde. Elles viennent en particulier de l'Union européenne, la Chine, les États-Unis et le Royaume-Uni. Après les avancées réglementaires de l'UE et de la Chine, la Maison-Blanche publie en octobre 2023 un décret sur l'IA « sûre, sécurisée et digne de confiance ». En novembre 2023 a lieu un premier sommet en sécurité de l'IA au Royaume-Uni.
En Europe, les services numériques sont réglementés par le RGPD, le règlement sur les services numériques et la législation sur les marchés numériques. Pour l'intelligence artificielle en particulier, la législation sur l'intelligence artificielle (Artificial Intelligence Act, ou AI Act en anglais) définit quatre niveaux de risques pour les applications d'IA et met en avant des exigences de transparence, de protection des données, de sécurité et d'éthique.
En 2017, les Émirats arabes unis sont le premier pays au monde à se doter d'un ministre dédié à l'intelligence artificielle : Omar Sultan Al Olama."			https://fr.wikipedia.org/wiki/Intelligence_artificielle	wikipedia	Section 59	
wikipedia_59	Intelligence artificielle	"Appels à des règles éthiques pour l'IA
Dans la seconde moitié des années 2010, des lanceurs d'alerte et des enquêtes révèlent que l'IA, encore émergente, a déjà été utilisée à des fins malveillantes pour faire basculer des processus électoraux. Le premier cas notable a été la plate-forme RIPON, secrètement créée par le Groupe SCL, à la demande de Steve Bannon et du milliardaire américain Robert Mercer. Cette plateforme, principalement au service de groupes politiques libertariens de droite, a été un outil de désinformation, de production et de diffusion de fake news à grande échelle,. Ripon, impliquée dans le scandale Facebook-Cambridge Analytica/Aggregate IQ), joua un rôle important dans la manipulation d’un grand nombre d'électeurs, notamment pour faire élire Donald Trump lors de l'élection présidentielle américaine de 2016, pour faire advenir le Brexit, ainsi que pour orienter des dizaines d'élections dans le monde.
Face à ces dérives, les géants du secteur de l’IA ont réagi en créant le 28 septembre 2016 un « partenariat pour l'intelligence artificielle au bénéfice des citoyens et de la société ». L'année suivante, Google DeepMind se dote d'une unité interne pour aborder les questions éthiques et une conférence rassemblant des personnalités influentes propose une charte pour réglementer les développements en IA.
Le 18 juillet 2018, 2 400 chercheurs, ingénieurs et personnalités du secteur de l'intelligence artificielle signent une lettre ouverte, s'engageant à « ne jamais participer ou soutenir le développement, la fabrication, le commerce ou l'usage d'armes létales autonomes ». La lettre précise que « La décision de prendre une vie humaine ne devrait jamais être déléguée à une machine ». Parmi les signataires se trouvent Elon Musk, les dirigeants de Google DeepMind Stuart Russell, Yoshua Bengio, et Toby Walsh.
Fin 2020, l'UNESCO rejoint (en tant qu'observateur, comme l'OCDE) le conseil et le comité directeur du Partenariat mondial sur l'intelligence artificielle, avec la possibilité de participer activement aux travaux de ces organismes.
La publication en février 2020 d'un Livre blanc sur l'intelligence artificielle, pose les bases du règlement sur l'intelligence artificielle de 2021 par la Commission européenne, qui vise à encadrer les risques et les problèmes éthiques de ces technologies. Ce projet classe les risques en quatre catégories, dont la plus grave est qualifiée comme suit :"			https://fr.wikipedia.org/wiki/Intelligence_artificielle	wikipedia	Section 60	
